1258847883.100501 IP 172.16.137.1.37382 > 172.16.137.129.http: S 747603118:747603118(0) win 5840 <mss 1460,sackOK,timestamp 2687643803 0,nop,wscale 7>
1258847883.140768 IP 172.16.137.129.http > 172.16.137.1.37382: S 2913050192:2913050192(0) ack 747603119 win 5792 <mss 1460,sackOK,timestamp 2635049034 2687643803,nop,wscale 6>
1258847883.140825 IP 172.16.137.1.37382 > 172.16.137.129.http: . ack 1 win 46 <nop,nop,timestamp 2687643843 2635049034>
1258847883.140951 IP 172.16.137.1.37382 > 172.16.137.129.http: P 1:48(47) ack 1 win 46 <nop,nop,timestamp 2687643843 2635049034>
1258847883.181811 IP 172.16.137.129.http > 172.16.137.1.37382: . ack 48 win 91 <nop,nop,timestamp 2635049075 2687643843>
1258847883.181909 IP 172.16.137.1.37382 > 172.16.137.129.http: P 48:66(18) ack 1 win 46 <nop,nop,timestamp 2687643884 2635049075>
1258847883.222817 IP 172.16.137.129.http > 172.16.137.1.37382: . ack 66 win 91 <nop,nop,timestamp 2635049115 2687643884>
1258847883.223801 IP 172.16.137.129.http > 172.16.137.1.37382: . 1:1449(1448) ack 66 win 91 <nop,nop,timestamp 2635049117 2687643884>
1258847883.223805 IP 172.16.137.129.http > 172.16.137.1.37382: . 1449:2897(1448) ack 66 win 91 <nop,nop,timestamp 2635049117 2687643884>
1258847883.223834 IP 172.16.137.129.http > 172.16.137.1.37382: P 2897:4345(1448) ack 66 win 91 <nop,nop,timestamp 2635049117 2687643884>
1258847883.223931 IP 172.16.137.1.37382 > 172.16.137.129.http: . ack 1449 win 69 <nop,nop,timestamp 2687643926 2635049117>
1258847883.223931 IP 172.16.137.1.37382 > 172.16.137.129.http: . ack 2897 win 91 <nop,nop,timestamp 2687643926 2635049117>
1258847883.223932 IP 172.16.137.1.37382 > 172.16.137.129.http: . ack 4345 win 114 <nop,nop,timestamp 2687643926 2635049117>
1258847883.264815 IP 172.16.137.129.http > 172.16.137.1.37382: . 4345:5793(1448) ack 66 win 91 <nop,nop,timestamp 2635049158 2687643926>
1258847883.264848 IP 172.16.137.129.http > 172.16.137.1.37382: . 5793:7241(1448) ack 66 win 91 <nop,nop,timestamp 2635049158 2687643926>
1258847883.264870 IP 172.16.137.129.http > 172.16.137.1.37382: . 7241:8689(1448) ack 66 win 91 <nop,nop,timestamp 2635049158 2687643926>
1258847883.264891 IP 172.16.137.129.http > 172.16.137.1.37382: . 8689:10137(1448) ack 66 win 91 <nop,nop,timestamp 2635049158 2687643926>
1258847883.264912 IP 172.16.137.129.http > 172.16.137.1.37382: P 10137:11585(1448) ack 66 win 91 <nop,nop,timestamp 2635049158 2687643926>
1258847883.264938 IP 172.16.137.129.http > 172.16.137.1.37382: P 11585:13033(1448) ack 66 win 91 <nop,nop,timestamp 2635049158 2687643926>
1258847883.265051 IP 172.16.137.1.37382 > 172.16.137.129.http: . ack 5793 win 137 <nop,nop,timestamp 2687643967 2635049158>
1258847883.265052 IP 172.16.137.1.37382 > 172.16.137.129.http: . ack 7241 win 159 <nop,nop,timestamp 2687643967 2635049158>
1258847883.265053 IP 172.16.137.1.37382 > 172.16.137.129.http: . ack 8689 win 182 <nop,nop,timestamp 2687643967 2635049158>
1258847883.265053 IP 172.16.137.1.37382 > 172.16.137.129.http: . ack 10137 win 204 <nop,nop,timestamp 2687643967 2635049158>
1258847883.265054 IP 172.16.137.1.37382 > 172.16.137.129.http: . ack 11585 win 227 <nop,nop,timestamp 2687643967 2635049158>
1258847883.265054 IP 172.16.137.1.37382 > 172.16.137.129.http: . ack 13033 win 250 <nop,nop,timestamp 2687643967 2635049158>
1258847883.305841 IP 172.16.137.129.http > 172.16.137.1.37382: . 13033:14481(1448) ack 66 win 91 <nop,nop,timestamp 2635049199 2687643967>
1258847883.305873 IP 172.16.137.129.http > 172.16.137.1.37382: . 14481:15929(1448) ack 66 win 91 <nop,nop,timestamp 2635049199 2687643967>
1258847883.305894 IP 172.16.137.129.http > 172.16.137.1.37382: . 15929:17377(1448) ack 66 win 91 <nop,nop,timestamp 2635049199 2687643967>
1258847883.305915 IP 172.16.137.129.http > 172.16.137.1.37382: . 17377:18825(1448) ack 66 win 91 <nop,nop,timestamp 2635049199 2687643967>
1258847883.305941 IP 172.16.137.129.http > 172.16.137.1.37382: . 18825:20273(1448) ack 66 win 91 <nop,nop,timestamp 2635049199 2687643967>
1258847883.305963 IP 172.16.137.129.http > 172.16.137.1.37382: . 20273:21721(1448) ack 66 win 91 <nop,nop,timestamp 2635049199 2687643967>
1258847883.305983 IP 172.16.137.129.http > 172.16.137.1.37382: . 21721:23169(1448) ack 66 win 91 <nop,nop,timestamp 2635049199 2687643967>
1258847883.306108 IP 172.16.137.1.37382 > 172.16.137.129.http: . ack 14481 win 272 <nop,nop,timestamp 2687644008 2635049199>
1258847883.306109 IP 172.16.137.1.37382 > 172.16.137.129.http: . ack 15929 win 295 <nop,nop,timestamp 2687644008 2635049199>
1258847883.306110 IP 172.16.137.1.37382 > 172.16.137.129.http: . ack 17377 win 318 <nop,nop,timestamp 2687644008 2635049199>
1258847883.306110 IP 172.16.137.1.37382 > 172.16.137.129.http: . ack 18825 win 340 <nop,nop,timestamp 2687644008 2635049199>
1258847883.306110 IP 172.16.137.1.37382 > 172.16.137.129.http: . ack 20273 win 363 <nop,nop,timestamp 2687644008 2635049199>
1258847883.306111 IP 172.16.137.1.37382 > 172.16.137.129.http: . ack 21721 win 385 <nop,nop,timestamp 2687644008 2635049199>
1258847883.306111 IP 172.16.137.1.37382 > 172.16.137.129.http: . ack 23169 win 408 <nop,nop,timestamp 2687644009 2635049199>
1258847883.346865 IP 172.16.137.129.http > 172.16.137.1.37382: . 23169:24617(1448) ack 66 win 91 <nop,nop,timestamp 2635049240 2687644008>
1258847883.346900 IP 172.16.137.129.http > 172.16.137.1.37382: . 24617:26065(1448) ack 66 win 91 <nop,nop,timestamp 2635049240 2687644008>
1258847883.346922 IP 172.16.137.129.http > 172.16.137.1.37382: . 26065:27513(1448) ack 66 win 91 <nop,nop,timestamp 2635049240 2687644008>
1258847883.346948 IP 172.16.137.129.http > 172.16.137.1.37382: . 27513:28961(1448) ack 66 win 91 <nop,nop,timestamp 2635049240 2687644008>
1258847883.346969 IP 172.16.137.129.http > 172.16.137.1.37382: P 28961:30409(1448) ack 66 win 91 <nop,nop,timestamp 2635049240 2687644008>
1258847883.346990 IP 172.16.137.129.http > 172.16.137.1.37382: . 30409:31857(1448) ack 66 win 91 <nop,nop,timestamp 2635049240 2687644008>
1258847883.347010 IP 172.16.137.129.http > 172.16.137.1.37382: P 31857:33305(1448) ack 66 win 91 <nop,nop,timestamp 2635049240 2687644008>
1258847883.347031 IP 172.16.137.129.http > 172.16.137.1.37382: . 33305:34753(1448) ack 66 win 91 <nop,nop,timestamp 2635049240 2687644009>
1258847883.347051 IP 172.16.137.129.http > 172.16.137.1.37382: . 36201:37649(1448) ack 66 win 91 <nop,nop,timestamp 2635049240 2687644009>
1258847883.347072 IP 172.16.137.129.http > 172.16.137.1.37382: . 37649:39097(1448) ack 66 win 91 <nop,nop,timestamp 2635049240 2687644009>
1258847883.347282 IP 172.16.137.1.37382 > 172.16.137.129.http: . ack 24617 win 431 <nop,nop,timestamp 2687644050 2635049240>
1258847883.347283 IP 172.16.137.1.37382 > 172.16.137.129.http: . ack 26065 win 453 <nop,nop,timestamp 2687644050 2635049240>
1258847883.347284 IP 172.16.137.1.37382 > 172.16.137.129.http: . ack 27513 win 476 <nop,nop,timestamp 2687644050 2635049240>
1258847883.347284 IP 172.16.137.1.37382 > 172.16.137.129.http: . ack 28961 win 469 <nop,nop,timestamp 2687644050 2635049240>
1258847883.347285 IP 172.16.137.1.37382 > 172.16.137.129.http: . ack 30409 win 459 <nop,nop,timestamp 2687644050 2635049240>
1258847883.347285 IP 172.16.137.1.37382 > 172.16.137.129.http: . ack 34753 win 425 <nop,nop,timestamp 2687644050 2635049240,nop,nop,sack 1 {36201:37649}>
1258847883.347286 IP 172.16.137.1.37382 > 172.16.137.129.http: . ack 34753 win 425 <nop,nop,timestamp 2687644050 2635049240,nop,nop,sack 1 {36201:39097}>
1258847883.387979 IP 172.16.137.129.http > 172.16.137.1.37382: . 39097:40545(1448) ack 66 win 91 <nop,nop,timestamp 2635049281 2687644050>
1258847883.388044 IP 172.16.137.129.http > 172.16.137.1.37382: . 40545:41993(1448) ack 66 win 91 <nop,nop,timestamp 2635049281 2687644050>
1258847883.388088 IP 172.16.137.129.http > 172.16.137.1.37382: . 41993:43441(1448) ack 66 win 91 <nop,nop,timestamp 2635049281 2687644050>
1258847883.388111 IP 172.16.137.129.http > 172.16.137.1.37382: . 43441:44889(1448) ack 66 win 91 <nop,nop,timestamp 2635049281 2687644050>
1258847883.388134 IP 172.16.137.129.http > 172.16.137.1.37382: . 44889:46337(1448) ack 66 win 91 <nop,nop,timestamp 2635049281 2687644050>
1258847883.388156 IP 172.16.137.129.http > 172.16.137.1.37382: . 46337:47785(1448) ack 66 win 91 <nop,nop,timestamp 2635049281 2687644050>
1258847883.388180 IP 172.16.137.129.http > 172.16.137.1.37382: . 47785:49233(1448) ack 66 win 91 <nop,nop,timestamp 2635049281 2687644050>
1258847883.388202 IP 172.16.137.129.http > 172.16.137.1.37382: . 49233:50681(1448) ack 66 win 91 <nop,nop,timestamp 2635049281 2687644050>
1258847883.388224 IP 172.16.137.129.http > 172.16.137.1.37382: . 50681:52129(1448) ack 66 win 91 <nop,nop,timestamp 2635049281 2687644050>
1258847883.388247 IP 172.16.137.129.http > 172.16.137.1.37382: P 52129:53577(1448) ack 66 win 91 <nop,nop,timestamp 2635049281 2687644050>
1258847883.388269 IP 172.16.137.129.http > 172.16.137.1.37382: . 53577:55025(1448) ack 66 win 91 <nop,nop,timestamp 2635049281 2687644050>
1258847883.388292 IP 172.16.137.129.http > 172.16.137.1.37382: . 55025:56473(1448) ack 66 win 91 <nop,nop,timestamp 2635049281 2687644050>
1258847883.388317 IP 172.16.137.129.http > 172.16.137.1.37382: . 56473:57921(1448) ack 66 win 91 <nop,nop,timestamp 2635049281 2687644050>
1258847883.388480 IP 172.16.137.1.37382 > 172.16.137.129.http: . ack 34753 win 476 <nop,nop,timestamp 2687644091 2635049240,nop,nop,sack 1 {36201:40545}>
1258847883.388481 IP 172.16.137.1.37382 > 172.16.137.129.http: . ack 34753 win 476 <nop,nop,timestamp 2687644091 2635049240,nop,nop,sack 1 {36201:41993}>
1258847883.388482 IP 172.16.137.1.37382 > 172.16.137.129.http: . ack 34753 win 476 <nop,nop,timestamp 2687644091 2635049240,nop,nop,sack 1 {36201:43441}>
1258847883.388483 IP 172.16.137.1.37382 > 172.16.137.129.http: . ack 34753 win 476 <nop,nop,timestamp 2687644091 2635049240,nop,nop,sack 1 {36201:44889}>
1258847883.388483 IP 172.16.137.1.37382 > 172.16.137.129.http: . ack 34753 win 476 <nop,nop,timestamp 2687644091 2635049240,nop,nop,sack 1 {36201:46337}>
1258847883.388484 IP 172.16.137.1.37382 > 172.16.137.129.http: . ack 34753 win 476 <nop,nop,timestamp 2687644091 2635049240,nop,nop,sack 1 {36201:47785}>
1258847883.388484 IP 172.16.137.1.37382 > 172.16.137.129.http: . ack 34753 win 476 <nop,nop,timestamp 2687644091 2635049240,nop,nop,sack 1 {36201:49233}>
1258847883.388485 IP 172.16.137.1.37382 > 172.16.137.129.http: . ack 34753 win 476 <nop,nop,timestamp 2687644091 2635049240,nop,nop,sack 1 {36201:50681}>
1258847883.388486 IP 172.16.137.1.37382 > 172.16.137.129.http: . ack 34753 win 476 <nop,nop,timestamp 2687644091 2635049240,nop,nop,sack 1 {36201:52129}>
1258847883.388486 IP 172.16.137.1.37382 > 172.16.137.129.http: . ack 34753 win 476 <nop,nop,timestamp 2687644091 2635049240,nop,nop,sack 1 {36201:53577}>
1258847883.388487 IP 172.16.137.1.37382 > 172.16.137.129.http: . ack 34753 win 476 <nop,nop,timestamp 2687644091 2635049240,nop,nop,sack 1 {36201:55025}>
1258847883.388489 IP 172.16.137.1.37382 > 172.16.137.129.http: . ack 34753 win 476 <nop,nop,timestamp 2687644091 2635049240,nop,nop,sack 1 {36201:56473}>
1258847883.388490 IP 172.16.137.1.37382 > 172.16.137.129.http: . ack 34753 win 476 <nop,nop,timestamp 2687644091 2635049240,nop,nop,sack 1 {36201:57921}>
1258847883.429398 IP 172.16.137.129.http > 172.16.137.1.37382: . 57921:59369(1448) ack 66 win 91 <nop,nop,timestamp 2635049322 2687644091>
1258847883.429485 IP 172.16.137.129.http > 172.16.137.1.37382: . 34753:36201(1448) ack 66 win 91 <nop,nop,timestamp 2635049322 2687644091>
1258847883.429527 IP 172.16.137.129.http > 172.16.137.1.37382: . 59369:60817(1448) ack 66 win 91 <nop,nop,timestamp 2635049322 2687644091>
1258847883.429579 IP 172.16.137.129.http > 172.16.137.1.37382: . 60817:62265(1448) ack 66 win 91 <nop,nop,timestamp 2635049322 2687644091>
1258847883.429612 IP 172.16.137.129.http > 172.16.137.1.37382: . 62265:63713(1448) ack 66 win 91 <nop,nop,timestamp 2635049322 2687644091>
1258847883.429657 IP 172.16.137.129.http > 172.16.137.1.37382: . 63713:65161(1448) ack 66 win 91 <nop,nop,timestamp 2635049322 2687644091>
1258847883.429696 IP 172.16.137.129.http > 172.16.137.1.37382: . 65161:66609(1448) ack 66 win 91 <nop,nop,timestamp 2635049322 2687644091>
1258847883.429735 IP 172.16.137.129.http > 172.16.137.1.37382: . 66609:68057(1448) ack 66 win 91 <nop,nop,timestamp 2635049322 2687644091>
1258847883.429481 IP 172.16.137.1.37382 > 172.16.137.129.http: . ack 34753 win 476 <nop,nop,timestamp 2687644132 2635049240,nop,nop,sack 1 {36201:59369}>
1258847883.429524 IP 172.16.137.1.37382 > 172.16.137.129.http: . ack 59369 win 330 <nop,nop,timestamp 2687644132 2635049322>
1258847883.429576 IP 172.16.137.1.37382 > 172.16.137.129.http: . ack 60817 win 383 <nop,nop,timestamp 2687644132 2635049322>
1258847883.429609 IP 172.16.137.1.37382 > 172.16.137.129.http: . ack 62265 win 480 <nop,nop,timestamp 2687644132 2635049322>
1258847883.429652 IP 172.16.137.1.37382 > 172.16.137.129.http: . ack 63713 win 501 <nop,nop,timestamp 2687644132 2635049322>
1258847883.429694 IP 172.16.137.1.37382 > 172.16.137.129.http: . ack 65161 win 501 <nop,nop,timestamp 2687644132 2635049322>
1258847883.429733 IP 172.16.137.1.37382 > 172.16.137.129.http: . ack 66609 win 501 <nop,nop,timestamp 2687644132 2635049322>
1258847883.429771 IP 172.16.137.1.37382 > 172.16.137.129.http: . ack 68057 win 501 <nop,nop,timestamp 2687644132 2635049322>
1258847883.470390 IP 172.16.137.129.http > 172.16.137.1.37382: . 68057:69505(1448) ack 66 win 91 <nop,nop,timestamp 2635049363 2687644132>
1258847883.470452 IP 172.16.137.129.http > 172.16.137.1.37382: . 69505:70953(1448) ack 66 win 91 <nop,nop,timestamp 2635049363 2687644132>
1258847883.470490 IP 172.16.137.129.http > 172.16.137.1.37382: . 70953:72401(1448) ack 66 win 91 <nop,nop,timestamp 2635049363 2687644132>
1258847883.470531 IP 172.16.137.129.http > 172.16.137.1.37382: . 72401:73849(1448) ack 66 win 91 <nop,nop,timestamp 2635049363 2687644132>
1258847883.470569 IP 172.16.137.129.http > 172.16.137.1.37382: . 73849:75297(1448) ack 66 win 91 <nop,nop,timestamp 2635049363 2687644132>
1258847883.470606 IP 172.16.137.129.http > 172.16.137.1.37382: P 75297:76745(1448) ack 66 win 91 <nop,nop,timestamp 2635049363 2687644132>
1258847883.470646 IP 172.16.137.129.http > 172.16.137.1.37382: . 76745:78193(1448) ack 66 win 91 <nop,nop,timestamp 2635049364 2687644132>
1258847883.470683 IP 172.16.137.129.http > 172.16.137.1.37382: . 78193:79641(1448) ack 66 win 91 <nop,nop,timestamp 2635049364 2687644132>
1258847883.470448 IP 172.16.137.1.37382 > 172.16.137.129.http: . ack 69505 win 501 <nop,nop,timestamp 2687644173 2635049363>
1258847883.470487 IP 172.16.137.1.37382 > 172.16.137.129.http: . ack 70953 win 501 <nop,nop,timestamp 2687644173 2635049363>
1258847883.470528 IP 172.16.137.1.37382 > 172.16.137.129.http: . ack 72401 win 501 <nop,nop,timestamp 2687644173 2635049363>
1258847883.470566 IP 172.16.137.1.37382 > 172.16.137.129.http: . ack 73849 win 501 <nop,nop,timestamp 2687644173 2635049363>
1258847883.470603 IP 172.16.137.1.37382 > 172.16.137.129.http: . ack 75297 win 501 <nop,nop,timestamp 2687644173 2635049363>
1258847883.470644 IP 172.16.137.1.37382 > 172.16.137.129.http: . ack 76745 win 501 <nop,nop,timestamp 2687644173 2635049363>
1258847883.470681 IP 172.16.137.1.37382 > 172.16.137.129.http: . ack 78193 win 501 <nop,nop,timestamp 2687644173 2635049364>
1258847883.470718 IP 172.16.137.1.37382 > 172.16.137.129.http: . ack 79641 win 524 <nop,nop,timestamp 2687644173 2635049364>
1258847883.511382 IP 172.16.137.129.http > 172.16.137.1.37382: . 79641:81089(1448) ack 66 win 91 <nop,nop,timestamp 2635049404 2687644173>
1258847883.511433 IP 172.16.137.129.http > 172.16.137.1.37382: . 81089:82537(1448) ack 66 win 91 <nop,nop,timestamp 2635049404 2687644173>
1258847883.511472 IP 172.16.137.129.http > 172.16.137.1.37382: . 82537:83985(1448) ack 66 win 91 <nop,nop,timestamp 2635049404 2687644173>
1258847883.511517 IP 172.16.137.129.http > 172.16.137.1.37382: . 83985:85433(1448) ack 66 win 91 <nop,nop,timestamp 2635049404 2687644173>
1258847883.511554 IP 172.16.137.129.http > 172.16.137.1.37382: . 85433:86881(1448) ack 66 win 91 <nop,nop,timestamp 2635049404 2687644173>
1258847883.511591 IP 172.16.137.129.http > 172.16.137.1.37382: . 86881:88329(1448) ack 66 win 91 <nop,nop,timestamp 2635049404 2687644173>
1258847883.511627 IP 172.16.137.129.http > 172.16.137.1.37382: . 88329:89777(1448) ack 66 win 91 <nop,nop,timestamp 2635049404 2687644173>
1258847883.511664 IP 172.16.137.129.http > 172.16.137.1.37382: . 89777:91225(1448) ack 66 win 91 <nop,nop,timestamp 2635049404 2687644173>
1258847883.511701 IP 172.16.137.129.http > 172.16.137.1.37382: . 91225:92673(1448) ack 66 win 91 <nop,nop,timestamp 2635049404 2687644173>
1258847883.511431 IP 172.16.137.1.37382 > 172.16.137.129.http: . ack 81089 win 546 <nop,nop,timestamp 2687644214 2635049404>
1258847883.511469 IP 172.16.137.1.37382 > 172.16.137.129.http: . ack 82537 win 569 <nop,nop,timestamp 2687644214 2635049404>
1258847883.511515 IP 172.16.137.1.37382 > 172.16.137.129.http: . ack 83985 win 592 <nop,nop,timestamp 2687644214 2635049404>
1258847883.511552 IP 172.16.137.1.37382 > 172.16.137.129.http: . ack 85433 win 614 <nop,nop,timestamp 2687644214 2635049404>
1258847883.511589 IP 172.16.137.1.37382 > 172.16.137.129.http: . ack 86881 win 637 <nop,nop,timestamp 2687644214 2635049404>
1258847883.511625 IP 172.16.137.1.37382 > 172.16.137.129.http: . ack 88329 win 657 <nop,nop,timestamp 2687644214 2635049404>
1258847883.511662 IP 172.16.137.1.37382 > 172.16.137.129.http: . ack 89777 win 657 <nop,nop,timestamp 2687644214 2635049404>
1258847883.511699 IP 172.16.137.1.37382 > 172.16.137.129.http: . ack 91225 win 657 <nop,nop,timestamp 2687644214 2635049404>
1258847883.551549 IP 172.16.137.1.37382 > 172.16.137.129.http: . ack 92673 win 657 <nop,nop,timestamp 2687644254 2635049404>
1258847883.552380 IP 172.16.137.129.http > 172.16.137.1.37382: . 94121:95569(1448) ack 66 win 91 <nop,nop,timestamp 2635049445 2687644214>
1258847883.552415 IP 172.16.137.129.http > 172.16.137.1.37382: . 95569:97017(1448) ack 66 win 91 <nop,nop,timestamp 2635049445 2687644214>
1258847883.552439 IP 172.16.137.129.http > 172.16.137.1.37382: . 97017:98465(1448) ack 66 win 91 <nop,nop,timestamp 2635049445 2687644214>
1258847883.552461 IP 172.16.137.129.http > 172.16.137.1.37382: . 98465:99913(1448) ack 66 win 91 <nop,nop,timestamp 2635049445 2687644214>
1258847883.552483 IP 172.16.137.129.http > 172.16.137.1.37382: . 99913:101361(1448) ack 66 win 91 <nop,nop,timestamp 2635049445 2687644214>
1258847883.552505 IP 172.16.137.129.http > 172.16.137.1.37382: . 101361:102809(1448) ack 66 win 91 <nop,nop,timestamp 2635049445 2687644214>
1258847883.552527 IP 172.16.137.129.http > 172.16.137.1.37382: . 102809:104257(1448) ack 66 win 91 <nop,nop,timestamp 2635049445 2687644214>
1258847883.552550 IP 172.16.137.129.http > 172.16.137.1.37382: FP 104257:104745(488) ack 66 win 91 <nop,nop,timestamp 2635049445 2687644214>
1258847883.552674 IP 172.16.137.1.37382 > 172.16.137.129.http: . ack 92673 win 657 <nop,nop,timestamp 2687644255 2635049404,nop,nop,sack 1 {94121:95569}>
1258847883.552675 IP 172.16.137.1.37382 > 172.16.137.129.http: . ack 92673 win 657 <nop,nop,timestamp 2687644255 2635049404,nop,nop,sack 1 {94121:97017}>
1258847883.552676 IP 172.16.137.1.37382 > 172.16.137.129.http: . ack 92673 win 657 <nop,nop,timestamp 2687644255 2635049404,nop,nop,sack 1 {94121:98465}>
1258847883.552676 IP 172.16.137.1.37382 > 172.16.137.129.http: . ack 92673 win 657 <nop,nop,timestamp 2687644255 2635049404,nop,nop,sack 1 {94121:99913}>
1258847883.552677 IP 172.16.137.1.37382 > 172.16.137.129.http: . ack 92673 win 657 <nop,nop,timestamp 2687644255 2635049404,nop,nop,sack 1 {94121:101361}>
1258847883.552678 IP 172.16.137.1.37382 > 172.16.137.129.http: . ack 92673 win 657 <nop,nop,timestamp 2687644255 2635049404,nop,nop,sack 1 {94121:102809}>
1258847883.552678 IP 172.16.137.1.37382 > 172.16.137.129.http: . ack 92673 win 657 <nop,nop,timestamp 2687644255 2635049404,nop,nop,sack 1 {94121:104257}>
1258847883.552679 IP 172.16.137.1.37382 > 172.16.137.129.http: . ack 92673 win 657 <nop,nop,timestamp 2687644255 2635049404,nop,nop,sack 1 {94121:104746}>
1258847883.593492 IP 172.16.137.129.http > 172.16.137.1.37382: . 92673:94121(1448) ack 66 win 91 <nop,nop,timestamp 2635049486 2687644255>
1258847883.593672 IP 172.16.137.1.37382 > 172.16.137.129.http: . ack 104746 win 585 <nop,nop,timestamp 2687644296 2635049486>
1258847883.593673 IP 172.16.137.1.37382 > 172.16.137.129.http: F 66:66(0) ack 104746 win 657 <nop,nop,timestamp 2687644296 2635049486>
1258847883.634478 IP 172.16.137.129.http > 172.16.137.1.37382: . ack 67 win 91 <nop,nop,timestamp 2635049527 2687644296>
